{
  "snapshot_schema_version": "2.0",
  "snapshot_id": "snap_e99f57c673f9ac0a2486b82a40ff81e0050bdf5843253b6d83ab8d4fdab82efd",
  "generation_id": "gen_6c7a3ee954286a5116c459a237dde0b8f533e978e1af98b5108f61e70dde12af",
  "market_data_date": "2026-09-28",
  "generated_at": "2026-09-29T02:21:41+00:00",
  "market_data_cutoff_at": "2026-09-28T20:00:00+00:00",
  "config_version": "2026-07-schema-2.0",
  "config_hash": "ea3f00434f192ce01e61be1dac7dca7e60985abdd04492bfd48674f8f8efcfda",
  "schema_version": "2.0",
  "code_version": "7a38166ca7735eb868dd5f1dbbeb209a86e7ca07",
  "corporate_action_validation_version": "ca-reconciliation-2.0",
  "corporate_action_reconciliation": {
    "version": "ca-reconciliation-2.0",
    "status": "reconciled",
    "detected_corporate_action_count": 69,
    "reconciled_corporate_action_count": 69,
    "unreconciled_corporate_action_count": 0,
    "unreconciled_ticker_count": 0,
    "unavailable_ticker_count": 0,
    "total_ticker_count": 2569,
    "reconciled_ticker_count": 2569,
    "unavailable_ratio": 0.0,
    "unreconciled_ratio": 0.0,
    "configured_thresholds": {
      "max_unavailable_ratio": 0.05,
      "max_unreconciled_ratio": 0.02,
      "max_unreconciled_tickers": 20
    },
    "unavailable_tickers": [],
    "unreconciled_tickers": [],
    "reason_counts": {},
    "ticker_details": [
      {
        "ticker": "AD",
        "status": "reconciled",
        "reasons": [],
        "detected_count": 2,
        "reconciled_count": 2,
        "unreconciled_count": 0,
        "action_details": [
          {
            "date": "2026-01-23 00:00:00",
            "action_type": "special_distribution",
            "close_before": 60.279998779296875,
            "close_after": 47.91999816894531,
            "observed_factor": 0.7949568536720575,
            "raw_close_before": 60.279998779296875,
            "raw_close_after": 47.91999816894531,
            "reconstructed_close_before": 60.279998779296875,
            "reconstructed_close_after": 47.91999816894531,
            "selected_trading_dates": [
              "2026-01-22 00:00:00",
              "2026-01-23 00:00:00"
            ],
            "auto_adjust_requested": false,
            "auto_adjust_observed": false,
            "adj_close_available": true,
            "declared_split_ratio": null,
            "distribution_amount": 10.25,
            "source_price_basis": "unknown",
            "expected_factor": 0.8299601823562021,
            "reconciliation_method": "cash_distribution_continuity",
            "expected_raw_factor": 0.8299601823562021,
            "classification_reason": "cash_amount_added_back_to_close",
            "actual_factor": 0.7949568536720575,
            "distribution_adjusted_return": -0.035003328684144575,
            "status": "reconciled"
          },
          {
            "date": "2026-06-11 00:00:00",
            "action_type": "special_distribution",
            "close_before": 52.349998474121094,
            "close_after": 40.11000061035156,
            "observed_factor": 0.7661891457395114,
            "raw_close_before": 52.349998474121094,
            "raw_close_after": 40.11000061035156,
            "reconstructed_close_before": 52.349998474121094,
            "reconstructed_close_after": 40.11000061035156,
            "selected_trading_dates": [
              "2026-06-10 00:00:00",
              "2026-06-11 00:00:00"
            ],
            "auto_adjust_requested": false,
            "auto_adjust_observed": false,
            "adj_close_available": true,
            "declared_split_ratio": null,
            "distribution_amount": 11.0,
            "source_price_basis": "unknown",
            "expected_factor": 0.7898758295964844,
            "reconciliation_method": "cash_distribution_continuity",
            "expected_raw_factor": 0.7898758295964844,
            "classification_reason": "cash_amount_added_back_to_close",
            "actual_factor": 0.7661891457395114,
            "distribution_adjusted_return": -0.023686683856973145,
            "status": "reconciled"
          }
        ],
        "source_price_basis": [
          "unknown"
        ],
        "auto_adjust_requested": false
      },
      {
        "ticker": "AGL",
        "status": "reconciled",
        "reasons": [],
        "detected_count": 1,
        "reconciled_count": 1,
        "unreconciled_count": 0,
        "action_details": [
          {
            "date": "2026-03-31 00:00:00",
            "action_type": "split",
            "close_before": 8.024999618530273,
            "close_after": 7.909999847412109,
            "observed_factor": 0.9856698097713772,
            "raw_close_before": 8.024999618530273,
            "raw_close_after": 7.909999847412109,
            "reconstructed_close_before": 8.024999618530273,
            "reconstructed_close_after": 7.909999847412109,
            "selected_trading_dates": [
              "2026-03-30 00:00:00",
              "2026-03-31 00:00:00"
            ],
            "auto_adjust_requested": false,
            "auto_adjust_observed": false,
            "adj_close_available": true,
            "declared_split_ratio": 0.04,
            "distribution_amount": null,
            "source_price_basis": "split_adjusted",
            "expected_factor": 25.0,
            "expected_raw_factor": 25.0,
            "reconciliation_method": "observed_factor_basis_classification",
            "classification_reason": "close_continuous_across_declared_split",
            "status": "reconciled"
          }
        ],
        "source_price_basis": [
          "split_adjusted"
        ],
        "auto_adjust_requested": false
      },
      {
        "ticker": "AMCR",
        "status": "reconciled",
        "reasons": [],
        "detected_count": 1,
        "reconciled_count": 1,
        "unreconciled_count": 0,
        "action_details": [
          {
            "date": "2026-01-15 00:00:00",
            "action_type": "split",
            "close_before": 44.099998474121094,
            "close_after": 44.15999984741211,
            "observed_factor": 1.0013605754051493,
            "raw_close_before": 44.099998474121094,
            "raw_close_after": 44.15999984741211,
            "reconstructed_close_before": 44.099998474121094,
            "reconstructed_close_after": 44.15999984741211,
            "selected_trading_dates": [
              "2026-01-14 00:00:00",
              "2026-01-15 00:00:00"
            ],
            "auto_adjust_requested": false,
            "auto_adjust_observed": false,
            "adj_close_available": true,
            "declared_split_ratio": 0.2,
            "distribution_amount": null,
            "source_price_basis": "split_adjusted",
            "expected_factor": 5.0,
            "expected_raw_factor": 5.0,
            "reconciliation_method": "observed_factor_basis_classification",
            "classification_reason": "close_continuous_across_declared_split",
            "status": "reconciled"
          }
        ],
        "source_price_basis": [
          "split_adjusted"
        ],
        "auto_adjust_requested": false
      },
      {
        "ticker": "ANAB",
        "status": "reconciled",
        "reasons": [],
        "detected_count": 1,
        "reconciled_count": 1,
        "unreconciled_count": 0,
        "action_details": [
          {
            "date": "2026-04-20 00:00:00",
            "action_type": "split",
            "close_before": 45.00666809082031,
            "close_after": 50.95000076293945,
            "observed_factor": 1.1320544915728024,
            "raw_close_before": 45.00666809082031,
            "raw_close_after": 50.95000076293945,
            "reconstructed_close_before": 45.00666809082031,
            "reconstructed_close_after": 50.95000076293945,
            "selected_trading_dates": [
              "2026-04-17 00:00:00",
              "2026-04-20 00:00:00"
            ],
            "auto_adjust_requested": false,
            "auto_adjust_observed": false,
            "adj_close_available": true,
            "declared_split_ratio": 1.5,
            "distribution_amount": null,
            "source_price_basis": "split_adjusted",
            "expected_factor": 0.6666666666666666,
            "expected_raw_factor": 0.6666666666666666,
            "reconciliation_method": "observed_factor_basis_classification",
            "classification_reason": "close_continuous_across_declared_split",
            "status": "reconciled"
          }
        ],
        "source_price_basis": [
          "split_adjusted"
        ],
        "auto_adjust_requested": false
      },
      {
        "ticker": "APH",
        "status": "reconciled",
        "reasons": [],
        "detected_count": 1,
        "reconciled_count": 1,
        "unreconciled_count": 0,
        "action_details": [
          {
            "date": "2026-09-03 00:00:00",
            "action_type": "split",
            "close_before": 80.04000091552734,
            "close_after": 82.06999969482422,
            "observed_factor": 1.0253623032993127,
            "raw_close_before": 80.04000091552734,
            "raw_close_after": 82.06999969482422,
            "reconstructed_close_before": 80.04000091552734,
            "reconstructed_close_after": 82.06999969482422,
            "selected_trading_dates": [
              "2026-09-02 00:00:00",
              "2026-09-03 00:00:00"
            ],
            "auto_adjust_requested": false,
            "auto_adjust_observed": false,
            "adj_close_available": true,
            "declared_split_ratio": 2.0,
            "distribution_amount": null,
            "source_price_basis": "split_adjusted",
            "expected_factor": 0.5,
            "expected_raw_factor": 0.5,
            "reconciliation_method": "observed_factor_basis_classification",
            "classification_reason": "close_continuous_across_declared_split",
            "status": "reconciled"
          }
        ],